word,gramatica,defini,de,en,eo,es,fr,capital,nota,vide,orijina,tasonomia,pronuncia,simbol,usa,an,da,gl,he,mt,ru
jar,nom util,un contenador silindre de vitro o seramica,Krug,jar (container),NA,jarro,NA,NA,NA,NA,NA,NA,NA,NA,NA,NA,krukke,NA,NA,NA,NA
jena,nom anatomia,cada de la lados de la fas su la oio; cada de la lados de la interna de la boca,Wange,cheek,NA,mejilla,NA,NA,NA,NA,NA,NA,NA,NA,NA,NA,kind,NA,NA,NA,NA
jeno,nom anatomia,la junta entre la coxa e la gama basa en umanas,Knie,knee,NA,rodilla,NA,NA,NA,NA,NA,NA,NA,NA,NA,NA,knæ,NA,NA,NA,NA
jinastia,nom,NA,Gymnastik,gymnastics,NA,gimnasia,NA,NA,NA,NA,NA,NA,NA,NA,NA,NA,gymnastik,NA,NA,NA,NA
jus,nom cosini,un licuida en o estraeda de frutas o vejetales; un bevida preparada de esta,Saft,juice,NA,zumo,NA,NA,NA,NA,NA,NA,NA,NA,NA,NA,juice,NA,NA,NA,NA
labio,nom anatomia,un o la otra de la du partes spesa cual formi la bordas superior e inferior de la abri de la boca; un parte de la boca de alga insetos e crustaseos,Lippe,lip,NA,labio,NA,NA,NA,NA,NA,NA,NA,NA,NA,NA,læbe,NA,NA,NA,NA
lago,nom tera,un area grande de acua ensircada par tera,See,lake,NA,lago,NA,NA,NA,NA,NA,NA,NA,NA,NA,NA,sø,NA,NA,NA,NA
lege,nom governa,un sistem de regulas reconoseda par un nasion o comunia per regula la atas de sua membros,Gesetz,law,NA,ley,NA,NA,NA,NA,NA,NA,NA,NA,NA,NA,lov,NA,NA,NA,NA
lima,nom util,un util con surfas ru,Feile,file (tool),NA,lima,NA,NA,NA,NA,NA,NA,NA,NA,NA,NA,fil (redskab),NA,NA,NA,NA
lupo,nom mamal,un carnivor savaje en familia de can,Wolf,wolf,NA,lobo,NA,NA,NA,NA,NA,Canis lupus,NA,NA,NA,NA,ulv,NA,NA,NA,NA
lus,nom fisica,la enerjia natural cual stimula la vide e fa ce cosas deveni vidable,Licht,light (illumination),NA,luz,NA,NA,No usa `lus` per dise `lampa`.,NA,NA,NA,NA,NA,NA,NA,lys,NA,NA,NA,NA
madre,nom siensa-umana,un fem o animal fema en relata a un enfante o enfantes ci el ia pari; un fem o animal fema ci cura un enfante o enfantes en la mesma modo,Mutter,mother,NA,madre,NA,NA,NA,NA,NA,NA,NA,NA,NA,NA,mor,NA,NA,NA,NA
martel,nom util,un util con testa metal pesosa,Hammer,hammer,NA,martillo,NA,NA,NA,NA,NA,NA,NA,NA,NA,NA,hammer,NA,NA,NA,NA
media,nom,NA,Mitte,middle,NA,medio,NA,NA,NA,NA,NA,NA,NA,NA,NA,NA,NA,NA,NA,NA,NA
mente,nom siensa-umana,la parte de un person cual permete ce el persepi,Geist,mind,NA,mente,NA,NA,NA,NA,NA,NA,NA,NA,NA,NA,sind,NA,NA,NA,NA
mento,nom anatomia,la parte de la fas su la boca,Kinn,chin,NA,barbilla,NA,NA,NA,NA,NA,NA,NA,NA,NA,NA,hage,NA,NA,NA,NA
mercato,nom mone,un asembla de persones per compra e vende furnis,Markt,market,NA,mercado,NA,NA,NA,NA,NA,NA,NA,NA,NA,NA,marked,NA,NA,NA,NA
microscopio,nom util biolojia,un aparato otical,Mikroskop,microscope,NA,microscopio,NA,NA,NA,NA,NA,NA,NA,NA,NA,NA,mikroskop,NA,NA,NA,NA
mobilas,nom plural,NA,Möbel,furniture,NA,muebles,NA,NA,NA,NA,NA,NA,NA,NA,NA,NA,møbel,NA,NA,NA,NA
model,nom,NA,Muster,model,NA,patrón,NA,NA,NA,NA,NA,NA,NA,NA,NA,NA,mønster,NA,NA,NA,NA
molin,nom util arciteta anatomia,un aparato per mole gran o otra cosas; un construida conteninte xef un tal aparato; un parte musculosa de la stomaco de un avia,Mühle,mill; gizzard,NA,molino,NA,NA,NA,NA,NA,NA,NA,NA,NA,NA,mølle,NA,NA,NA,NA
mone,nom mone,un media de intercambia cual ave la forma de pesos de metal impresada o paperes prometente de un banco sentral,Geld,money,NA,dinero,NA,NA,NA,NA,NA,NA,NA,NA,NA,NA,penge,NA,NA,NA,NA
moneta,nom,NA,Münze,coin,NA,moneda,NA,NA,NA,NA,NA,NA,NA,NA,NA,NA,mønt,NA,NA,NA,NA
mur,nom arciteta,un lado vertical de un construida o sala; un strutur vertical e continuante de brices o petras cual ensirca o divide un area de tera; alga cosa usada como un parador per proteje o restrinje,Wand,wall; bulkhead (ship),NA,pared,NA,NA,NA,NA,NA,NA,NA,NA,NA,NA,væg,NA,NA,NA,NA
note,nom,la periodo de oscuria en cada 24 oras; la tempo entre la reposa de sol e la leva de sol,Nacht,night,NA,noche,NA,NA,NA,NA,NA,NA,NA,NA,NA,NA,nat,NA,NA,NA,NA
nube,nom tera,un masa vidable de vapor condensada de acua,Wolke,cloud,NA,nube,NA,NA,NA,NA,NA,NA,NA,NA,NA,NA,sky,NA,NA,NA,NA
odor,nom biolojia,un cualia olable,Duft,smell,NA,olor,NA,NA,NA,NA,NA,NA,NA,NA,NA,NA,lugt,NA,NA,NA,NA
oio,nom anatomia,cada de la du organos sfera en la testa,Auge,eye,NA,oir,NA,NA,NA,NA,NA,NA,NA,NA,NA,NA,øje,NA,NA,NA,NA
om,nom siensa-umana,un umana adulte mas; (nonformal) un sposo,Mann,man; guy,NA,hombre,NA,NA,NA,NA,NA,NA,NA,NA,NA,NA,mand,NA,NA,NA,NA
osidi,nom,NA,Rost,rust,NA,moho,NA,NA,NA,NA,NA,NA,NA,NA,NA,NA,rust,NA,NA,NA,NA
oso,nom anatomia,cada de la pesos de texeda dur e blancin cual composa la sceleto de umanas e otra vertebratos; la materia estas es composada,Bein,bone,NA,hueso,NA,NA,NA,NA,NA,NA,NA,NA,NA,NA,ben,NA,NA,NA,NA
ovea,nom mamal cosini,un mamal domada e remasticante,Schaf,sheep,NA,ovejas,NA,NA,NA,NA,NA,Ovis aries,NA,NA,NA,NA,får,NA,NA,NA,NA
paje,nom informatica,un lado de un folia de paper en un colie como un libro o jornal; un presenta simil,Seite,page,NA,página,NA,NA,NA,NA,NA,NA,NA,NA,NA,NA,side (i et dokument),NA,NA,NA,NA
palo,nom util,un peso de lenio o metal longa,Most,pole,stango,poste,poteau,NA,NA,NA,NA,NA,NA,NA,NA,NA,stang,NA,NA,NA,NA
pan,nom cosini,un comeda preparada de farina,Brot,bread,NA,pan,NA,NA,NA,NA,NA,NA,NA,NA,NA,NA,brød,NA,NA,NA,NA
pede,nom anatomia,la parte la plu basa de la gama,Fuss,foot,NA,pie,NA,NA,NA,NA,NA,NA,NA,NA,NA,NA,fod,NA,NA,NA,NA
pel,nom anatomia,la strato magra de texeda cual formi la covrente natural esterna de la corpo de un person o animal; esta texeda,Haut,skin,NA,piel,NA,NA,NA,NA,NA,NA,NA,NA,NA,NA,skind,NA,NA,NA,NA
pen,nom util,un strumento de metal,Feder,pen,NA,pluma,NA,NA,NA,NA,NA,NA,NA,NA,NA,NA,pen,NA,NA,NA,NA
piso,nom planta cosini,un seme sfera e verde,Erbse,pea (plant,NA,guisante,NA,NA,NA,NA,NA,Pisum sativum,NA,NA,NA,NA,ært,NA,NA,NA,NA
plana,nom,NA,Ebene,plane (surface); counter,ebenaĵo,plano,plan,NA,NA,NA,NA,NA,NA,NA,NA,NA,flade,NA,NA,NA,NA
plano,nom tera,un rejion grande de tera plana sin multe arbores,Ebene,plain,ebenaĵo,llano,plaine,NA,NA,NA,NA,NA,NA,NA,NA,NA,NA,NA,NA,NA,ru: равнина
plomo,nom cimica,la elemento cimical con numero atomal 82,Blei,lead,plumbo,plomo,plomb,NA,NA,NA,NA,NA,NA,Pb (plumbum),NA,NA,bly,NA,NA,NA,NA
polalia,nom,NA,Polarität,polarity (electric,poluseco,polaridad,polarité,NA,NA,NA,NA,NA,NA,NA,NA,NA,polaritet,NA,NA,NA,NA
poma,nom planta cosini,un fruta ronda,Apfel,apple (fruit),NA,manzana,NA,NA,NA,NA,NA,NA,NA,NA,NA,NA,æble,NA,NA,NA,NA
portor,nom,NA,Pförtner,porter,portisto,mozo,porteur,NA,NA,NA,NA,NA,NA,NA,NA,NA,NA,NA,NA,NA,ru: носильщик
posteria,nom,NA,Postamt,post office,poŝtoficejo,oficina de correos,bureau de poste,NA,NA,NA,NA,NA,NA,NA,NA,NA,NA,NA,NA,NA,ru: почта (учреждение)
pulea,nom util,un rota con borda ranurida sirca cual un corda pasa,Rolle,pulley,pulio,polea,poulie,NA,NA,NA,NA,NA,NA,NA,NA,NA,remskive,NA,NA,NA,NA
rabi,nom relijio,un erudita o ensenior iudi,Rabbiner,rabbi,rabeno,rabino,rabbin,NA,NA,NA,NA,NA,NA,NA,NA,NA,NA,NA,NA,NA,ru: раввин
raio,nom fisica,cada de la linias en cual lus,Strahl,ray,radio; spoko; radius,rayo,rayon,NA,NA,NA,NA,NA,NA,NA,NA,NA,stråle,NA,NA,NA,NA
ren,nom anatomia,cada de du organos en la adomen de mamales,Niere,kidney,reno,riñón,rein,NA,NA,NA,NA,NA,NA,NA,NA,NA,nyre,NA,NA,NA,NA
salsa,nom cosini,un licuida densa,Soße,sauce,saŭco,salsa,sauce,NA,NA,NA,NA,NA,NA,NA,NA,NA,NA,NA,NA,NA,ru: соус
sapon,nom util,un composada de olios o grases con idrosido de sodio o otra alcalin forte,Seife,soap,sapo,jabón,savon,NA,NA,NA,NA,NA,NA,NA,NA,NA,sæbe,NA,NA,NA,ru: мыло
seja,nom arciteta,un mobila sur cual on senta; un de la postos en un legeria,Stuhl,chair,seĝo,silla,chaise,NA,NA,NA,NA,NA,NA,NA,NA,NA,stol,NA,NA,NA,ru: стул
sejon,nom,NA,Sessel,armchair,fotelo,sillón,fauteuil,NA,NA,NA,NA,NA,NA,NA,NA,NA,NA,NA,NA,NA,ru: кресло
sera,nom,la periodo de tempo a la fini de la dia,Abend,evening,vespero,noche,soir,NA,NA,NA,NA,NA,NA,NA,NA,NA,aften,NA,NA,NA,NA
sielo,nom tera relijio mitolojia,la atmosfera e spasio,Himmel,sky,ĉielo,cielo; paraíso,ciel,NA,NA,NA,NA,NA,NA,NA,NA,NA,himmel; paradis,NA,NA,NA,ru: небо
siera,nom util,un util per talia lenio o otra materiales,Säge,saw (tool),segilo,sierra,scie,NA,NA,NA,NA,NA,NA,NA,NA,NA,sav,NA,NA,NA,NA
simbol,nom linguistica informatica,un cosa cual representa un otra cosa,Sinnbild,symbol,simbolo,símbolo,symbole,NA,NA,NA,NA,NA,NA,NA,NA,NA,symbol,NA,NA,NA,NA
sinema,nom arte arciteta,un teatro cual mostra filmas,Kino,cinema,NA,NA,NA,NA,NA,NA,NA,NA,NA,NA,NA,NA,biograf,NA,NA,NA,NA
sinifia,nom,NA,Sinn,meaning,NA,significado,signification,NA,NA,NA,NA,NA,NA,NA,NA,NA,betydning,NA,NA,NA,NA
siringa,nom util medica,un tubo peti con un boceta e un piston per suca o ejeta licuida,Spritze,syringe,NA,NA,NA,NA,NA,NA,NA,NA,NA,NA,NA,NA,sprøjte,NA,NA,NA,NA
sisor,nom util,un util usada per talia stofa,Schere,scissor,tondilo,tijera(s),ciseaux,NA,NA,NA,NA,NA,NA,NA,NA,NA,saks,NA,NA,NA,NA
site,nom arciteta,un vila multe grande,Stadt,city,urbego,ciudad,ville,NA,NA,NA,NA,NA,NA,NA,la site Moscva,NA,city,NA,NA,NA,NA
sona,nom,NA,Laut,sound,sono,sonido,bruit,NA,NA,NA,NA,NA,NA,NA,NA,NA,lyd,NA,NA,NA,NA
spuma,nom,NA,Schaum,foam,ŝaŭmo,espuma,écume,NA,NA,NA,NA,NA,NA,NA,NA,NA,skum,NA,NA,NA,NA
state,nom fisica cimica,la forma o cualia de la esiste de un person o cosa a un tempo spesifada,Zustand,state (of affairs),stato,condición,condition,NA,NA,NA,NA,NA,NA,NA,NA,NA,kondition,NA,NA,NA,NA
table,nom arciteta,un mobila con surfas plana e un o plu gamas,Tisch,table (furniture); board (game); table (of information),NA,mesa,table; tableau,NA,NA,NA,NA,NA,NA,NA,NA,NA,bord,NA,NA,NA,ru: стол
telon,nom,NA,Decke,sheet,NA,hoja,nappe,NA,NA,NA,NA,NA,NA,NA,NA,NA,ark,NA,NA,NA,ru: скатерть
tempo,nom,la progresa continuante de esiste e avenis en la pasada,Zeit,time (concept,NA,tiempo,temps,NA,NA,ves,NA,NA,NA,NA,NA,NA,tid,NA,NA,NA,NA
teto,nom arciteta,la strutur cual covre la culmina de un construida o veculo; la covrente de un contenador; la nivel su sielo de un barcon,Dach,roof,tegmento; ferdeko,techo,toit; pont (de bateau),NA,NA,NA,NA,NA,NA,NA,NA,NA,tag,NA,NA,NA,ru: крыша
tipo,nom,un categoria de persones o cosas cual ave cualias comun; un spesie de letera primida o mostrada sur scermo,Art,type,NA,clase,type,NA,NA,NA,NA,NA,NA,NA,NA,NA,slags,NA,NA,NA,NA
tona,nom,NA,Donner,thunder,NA,trueno,tonnerre,NA,NA,NA,NA,NA,NA,NA,NA,NA,torden,NA,NA,NA,ru: гром
tono,nom musica,la cualia de un sona produida par un frecuentia spesifada de vibras; un sona de musica o vose; la alti e basi de la vose en parla,Tonhöhe,tone,NA,tono,ton,NA,NA,NA,NA,NA,NA,NA,NA,NA,tone,NA,NA,NA,NA
tren,nom veculo,un serie de vagones tirada como un unia par un locomotiva o par motores integrada; un serie de animales o veculos viajante en la mesma dirije,Zug,train,trajno,tren (ferrocarril),train,NA,NA,NA,NA,NA,NA,NA,NA,NA,tog,NA,NA,NA,ru: поезд
tubo,nom util,un silindre longa e vacua de metal,Rohr,tube,NA,tubo,tube,NA,NA,NA,NA,NA,NA,NA,NA,NA,rør,NA,NA,NA,NA
ungia,nom anatomia,un covrente cornin sur la surfas superior de la fini de la dito o orteo de umanas e otra animales,Nagel,nail,NA,uña,ongle,NA,NA,NA,NA,NA,NA,NA,NA,NA,negl,NA,NA,NA,ru: ноготь
urina,nom biolojia,un licuida acuin,Harn,urine,urino,orina,urine,NA,NA,NA,NA,NA,NA,NA,NA,NA,urin,NA,NA,NA,NA
urso,nom mamal,un mamal grande e pesosa cual pote pasea sur la plantas de sua pedes,Bär,bear,urso,oso,ours,NA,NA,NA,NA,Ursidae,NA,NA,NA,NA,bjørn,NA,NA,NA,ru: медведь
Valahia,nom jeografial,un rena pasada en Europa sude-este,Walachei,Wallachia (Romanian region),NA,Valaquia (región rumana),Valachie (région roumaine),NA,NA,NA,NA,NA,NA,NA,NA,NA,NA,NA,NA,NA,ru: Валахия
vapor,nom fisica,un materia difusada o suspendeda en la aira,Dampf,vapor|ur,vaporo,vapor,vapeur,NA,NA,NA,NA,NA,NA,NA,NA,NA,damp,NA,NA,NA,NA
vela,nom veculo,un peso de materia estendeda sur un masto per usa la venta per propulsa un barco o otra veculo; un aparato cual catura la venta a un braso de un molin,Segel,sail,velo,vela (de barco),(une) voile,NA,NA,NA,NA,NA,NA,NA,NA,NA,sejl,NA,NA,NA,NA
venta,nom,NA,Wind,wind,vento,viento,vent,NA,NA,NA,NA,NA,NA,NA,NA,NA,vind,NA,NA,NA,ru: ветер
via,nom,un tereno usada o creada per vade o viaja,Bahn,way,NA,ruta,voie,NA,NA,NA,NA,NA,NA,NA,NA,NA,rute,NA,NA,NA,ru: путь
vista,nom tera,un vide bela,Sicht,view,NA,vista,vue,NA,NA,NA,NA,NA,NA,NA,NA,NA,NA,NA,NA,NA,ru: вид
vive,nom,NA,Leben,life,NA,vida,vie,NA,NA,NA,NA,NA,NA,NA,NA,NA,liv,NA,NA,NA,NA
xace,nom,un jua per du persones sur un table de 64 cuadros negra e blanca; un situa en cual la re es menasada en esta jua,Schach,chess; check,ŝako,ajedrez,échecs; échec,NA,NA,NA,NA,NA,NA,NA,NA,NA,skak,NA,NA,NA,NA
xapo,nom veste,un veste per covre la testa; un paragraf de metadatos a la comensa de un fix,Hut,hat; header,ĉapelo; ĉapo,sombrero,chapeau,NA,NA,NA,NA,NA,NA,NA,NA,NA,hat,NA,NA,NA,ru: шапка
xece,nom mone,un paper cual comanda un move de mone entre du contas,Scheck,check|cheque (money),ĉeko,cheque,chèque,NA,NA,NA,NA,NA,NA,NA,NA,NA,check,NA,NA,NA,NA
Xvaben,nom jeografial,un rejion de Deutxland sude-ueste,Schwaben,Swabia (German region),NA,NA,NA,NA,NA,NA,NA,NA,NA,NA,NA,NA,NA,NA,NA,NA,NA
zero,nom,la dijito 0; la punto zero en un scala,Null,zero,nulo,NA,NA,NA,NA,NA,NA,NA,NA,NA,NA,NA,NA,NA,NA,NA,NA
acua,nom,la licuida cual formi la mares,Wasser,water,akvo,agua,eau,NA,NA,NA,NA,NA,NA,NA,NA,agua,vand,auga,מים,ilma,ru: вода
altia,nom,NA,Höhe,height,NA,altura,hauteur,NA,NA,NA,NA,NA,NA,NA,NA,altor,højde,NA,he: גובה,NA,NA
ambiente,nom,NA,Umwelt,surroundings,NA,ambiente,environnement,NA,NA,NA,NA,NA,NA,NA,NA,ambiente,miljø,NA,he: סביבה; אווירה,NA,NA
anca,nom anatomia,un estende de la pelvis e la femor en umanas e cuatropedes,Hüfte,hip,NA,cadera,hanche,NA,NA,NA,NA,NA,NA,NA,NA,cadril,hofte,NA,he: עצם הירך,NA,NA
anelo,ajetivo util veste,con forma de O,Ring,ring-shaped,NA,NA,annulaire,NA,NA,NA,NA,NA,NA,NA,NA,aníu,ring,NA,he: טבעתי,NA,NA
angulo,ajetivo matematica,NA,Winkel,angular,NA,NA,angulaire,NA,NA,NA,NA,NA,NA,NA,NA,ángulu,vinkel,NA,he: זוויתי,NA,NA
animal,nom,NA,Tier,animal,NA,animal,NA,NA,NA,NA,NA,NA,NA,NA,NA,animal,dyr,NA,he: חיה,NA,NA
anunsia,nom,NA,Anzeige,announcement,NA,anuncio,annonce,NA,NA,NA,NA,NA,NA,NA,NA,NA,bekendtgørelse,NA,he: הכרזה,NA,NA
arado,nom,un aparato grande de cultiva con un o plu laminas pesosa,Pflug,plow|plough,NA,arado,charrue,NA,NA,NA,NA,NA,NA,NA,NA,NA,plov,NA,he: מחרשה,NA,NA
arania,nom artropodo,un artropodo xasante,Spinne,spider,NA,araña,araignée,NA,NA,NA,NA,Araneae,NA,NA,NA,NA,ederkop,NA,he: עכביש,NA,NA
arbor,nom planta,un planta leniosa,Baum,tree,NA,árbol,arbre,NA,NA,NA,NA,NA,NA,NA,NA,NA,træ,NA,he: עץ,NA,NA
arcivo,nom informatica,un colie de informa rejistrada; un portapaper; (en un computador) un spesie de fix cual grupi otra fixes o suarcivos,Akte,record (information),NA,archivo,archive,NA,NA,NA,NA,NA,NA,NA,NA,NA,fil,NA,he: רשומה,NA,NA
area,nom,la grandia de un surfas o peso de tera; un parte de un site,Gegend,area,NA,area,superficie,NA,NA,NA,NA,NA,NA,NA,NA,NA,område,NA,he: איזור,NA,NA
arte,nom arte,la espresa o aplica de la creosia e imajina umana,Kunst,art,NA,arte,art,NA,NA,NA,NA,NA,NA,NA,NA,NA,kunst,arte,he: אמנות,NA,NA
aser,nom cimica,un aliada de fero con carbono e tipal otra elementos,Stahl,steel; frizzen (gun),NA,acero,acier,NA,NA,NA,NA,NA,NA,NA,NA,NA,stål,NA,he: פלדה,NA,NA
atende,nom,NA,Acht,attention,NA,NA,attention,NA,NA,NA,NA,NA,NA,NA,NA,NA,opmærksomhed,NA,he: תשומת לב; קשב; השגחה,NA,NA
avia,nom avia,un vertebrato oviparinte con sangue calda,Vogel,bird,NA,ave,oiseau,NA,NA,NA,NA,NA,NA,NA,NA,NA,fugl,NA,he: ציפור,NA,NA
baleta,nom,un misil metal peti,Kugel,bullet,NA,bala (munición),balle (munition),NA,NA,NA,NA,NA,NA,NA,NA,NA,kugle,NA,he: קליע,NA,NA
balansa,nom util,un plance longa,Waage,seesaw; scales,NA,balanza,balançoire à bascule,NA,NA,NA,NA,NA,NA,NA,NA,NA,balancevægt,balanza,he: נדנדה; מאזניים,NA,NA
balde,nom util,un contenador silindre e abrida,Eimer,bucket,NA,balde,seau,NA,NA,NA,NA,NA,NA,NA,NA,NA,spand,NA,he: דלי,NA,NA
bandera,nom,un peso de stofa,Fahne,flag,NA,bandera,drapeau,NA,NA,NA,NA,NA,NA,NA,NA,NA,flag,NA,he: דגל,NA,NA
bara,nom,un peso longa de lenio,Stange,bar,NA,barra,barre,NA,NA,NA,NA,NA,NA,/,NA,NA,stang,NA,he: מוט,NA,NA
bileta,nom,un paper o carta peti cual permete ce sua posesor entra a un loca,Karte,ticket; coupon,NA,boleto,billet,NA,NA,NA,NA,NA,NA,NA,NA,NA,billet,NA,he: כרטיס,NA,NA
bobin,nom veste,un cosa silindre sur cual on pote enrola un banda,Spule,spool,NA,carrete,bobine,NA,NA,NA,NA,NA,NA,NA,NA,NA,spole,NA,he: סליל,NA,NA
bol,nom util,un plato larga e ronda,Schale,basin,NA,cuenco,bol,NA,NA,NA,NA,NA,NA,NA,NA,NA,skål,NA,he: קערה,NA,NA
boteca,nom arciteta,un construida en cual on vende cosas a la popla,Laden,shop,NA,tienda,boutique,NA,NA,NA,NA,NA,NA,NA,NA,NA,forretning,NA,he: חנות,NA,NA
caje,nom arciteta,un strutur de baras o redes metal per restrinje animales,Käfig,cage,NA,jaula,cage,NA,NA,NA,NA,NA,NA,NA,NA,NA,bur,gaiola,he: כלוב,NA,NA
camisa,nom veste,un veste relativa formal per la corpo superior,Hemd,shirt,NA,camisa,chemise,NA,NA,NA,NA,NA,NA,NA,NA,NA,skjorte,camisa,he: חולצה,NA,NA
campo,nom,un area de tera,Feld,field (grass,NA,campo,champ,NA,NA,NA,NA,NA,NA,NA,NA,NA,mark,campo,he: שדה; מגרש; תחום,NA,NA
capeles,nom plural,NA,Haare,hairs,NA,NA,cheveux,NA,NA,NA,NA,NA,NA,NA,NA,NA,NA,NA,he: שיער,NA,NA
capra,nom mamal,un mamal remasticante domada,Ziege,goat,NA,cabra,chèvre,NA,NA,NA,NA,Capra,NA,NA,NA,NA,ged,NA,he: עֵז,NA,NA
capris,nom siensa-umana,un cambia subita o nonpredisable de umor o condui,Laune,caprice,NA,capricho,caprice,NA,NA,NA,NA,NA,NA,NA,NA,NA,lune,NA,he: קפריזה,NA,NA
carga,verbo transitiva veculo,pone cosas sur o en (un contenador o veculo); pone alga cosa en (un aparato) afin lo pote funsiona; furni enerjia eletrical a un pila o aparato con pila; (en informatica) move (un program o datos) a memoria plu fasil per asede,Ladung,load,NA,NA,charger,NA,NA,NA,NA,NA,NA,NA,NA,NA,byrde,NA,he: להעמיס; (מחשבים) להעלות; להטעין,NA,NA
casca,nom biolojia,la covrente esterna de un fruta,Hülse,skin,NA,NA,cosse (de pois),NA,NA,NA,NA,NA,NA,NA,NA,NA,NA,NA,he: קליפה,NA,NA
catran,nom cimica,un licuida oscur,Teer,tar,NA,chapopote,goudron,NA,NA,NA,NA,NA,NA,NA,NA,NA,tjære,NA,he: זפת,NA,NA
cauxo,nom cimica,un materia dur e elastica,Gummi,rubber,NA,hule,caoutchouc,NA,NA,NA,NA,NA,NA,NA,NA,NA,gummi,NA,he: גומי,NA,NA
cava,nom tera anatomia,un cambra grande,Höhle,cave,NA,cueva,grotte,NA,NA,NA,NA,NA,NA,NA,NA,NA,hule,NA,he: מערה,NA,NA
caxa,nom util,un contenador con funda e lados plana,Kasten,box,NA,caja,caisse,NA,NA,NA,NA,NA,NA,NA,NA,NA,æske,NA,he: קופסה,NA,NA
clo,nom util,un spina metal peti con un fini plata e larga,Nagel,nail,NA,clavo,clou,NA,NA,NA,NA,NA,NA,NA,NA,NA,søm,NA,he: מסמר,NA,NA
coda,nom anatomia biolojia,la parte la plu posterior de un animal,Schwanz,tail; coda; ending (grammar),NA,cola,queue; terminaison (grammaire),NA,NA,NA,NA,NA,NA,NA,NA,NA,hale,NA,he: זנב; (ספרות,NA,NA
colie,nom,NA,Satz,collection,NA,NA,ensemble,NA,NA,NA,NA,NA,NA,NA,NA,NA,sæt,NA,he: אוסף,NA,NA
color,nom color,la cualia de un cosa cual produi un sensa a la oio par la modo en cual lo refleta o emete lus; la pigmento de la pel,Farbe,color|ur,NA,color,couleur,NA,NA,NA,NA,NA,NA,NA,NA,NA,farve,NA,he: צבע,NA,NA
comeda,nom,NA,Essen,food,NA,alimento,nourriture,NA,NA,NA,NA,NA,NA,NA,NA,NA,mad,NA,he: מצרך (מזון),NA,NA
conca,nom biolojia,la caxa esterna,Schale,shell,NA,concha,coquillage,NA,NA,NA,NA,NA,NA,NA,NA,NA,skal,NA,he: קונכייה,NA,NA
cono,nom,NA,Kegel,cone,NA,cono,cône,NA,NA,NA,NA,NA,NA,NA,NA,NA,kegle,NA,he: חרוט,NA,NA
contrata,nom,NA,Vertrag,contract,NA,contrato (documento de común acuerdo),contrat,NA,NA,NA,NA,NA,NA,NA,NA,NA,kontrakt,NA,he: חוזה,NA,NA
corda,nom util,un peso longa de un materia fabricada par torse colies de fibres; (en matematica) un linia reta cual lia du finis de un arco,Seil,cord,NA,cuerda,corde,NA,NA,NA,NA,NA,NA,NA,NA,NA,kabel,NA,he: חבל,NA,NA
cotel,nom util,un strumento composada de un lamina fisada a un manico,Messer,knife,NA,cuchillo,couteau,NA,NA,NA,NA,NA,NA,NA,NA,NA,kniv,NA,he: סכין,NA,NA
crema,nom,un licuida densa,Sahne,cream,NA,crema,crème,NA,NA,NA,NA,NA,NA,NA,NA,NA,fløde,NA,he: קרם,NA,NA
cuerco,nom planta,un arbor cual produi un noza oval e lisa en un funda tasin,Eiche,oak,NA,roble,chêne,NA,NA,NA,NA,Quercus,NA,NA,NA,NA,eg,NA,he: אלון (עץ),NA,NA
culier,nom util,un util composada de un bol peti,Löffel,spoon,NA,cuchara,cuillère,NA,NA,NA,NA,NA,NA,NA,NA,NA,ske,NA,he: כף,NA,NA
cuneo,nom util,un peso de lenio,Keil,wedge,NA,cuña,coin (pour fendre le bois),NA,NA,NA,NA,NA,NA,NA,NA,NA,kile,NA,he: טריז,NA,NA
cuoro,nom util,un materia fabricada de la pel de un animal par tana o simil,Leder,leather,NA,cuero,cuir,NA,NA,NA,NA,NA,NA,NA,NA,NA,læder,NA,he: עור (מעובד),NA,NA
custa,nom,NA,Preis,cost,prezo,precio,prix,NA,NA,NA,NA,NA,NA,NA,NA,NA,pris,NA,עלות,NA,NA
cuxin,nom arciteta,un saco,Kissen,cushion,NA,cojín,coussin,NA,NA,NA,NA,NA,NA,NA,NA,NA,pude,NA,he: כר,NA,NA
debe,nom,NA,Pflicht,duty,NA,deber,devoir,NA,NA,NA,NA,NA,NA,NA,NA,NA,pligt,NA,חובה,NA,ru: обязанность
defeto,nom informatica,un nonperfeta; un problem peti,Fehler,defect,NA,defecto,défaut,NA,NA,NA,NA,NA,NA,NA,NA,NA,defekt,NA,פגם,NA,ru: дефект
densia,nom,NA,Dichte,density,NA,densidad,densité; résolution (d'une image),NA,NA,NA,NA,NA,NA,NA,NA,NA,tæthed,NA,he: דחיסות; סמיכות,NA,NA
dente,nom anatomia util,cada de un colie de strutures dur,Zahn,tooth; tine,NA,diente,dent,NA,NA,NA,NA,NA,NA,NA,NA,NA,tand,NA,he: שן,NA,NA
deserto,nom tera,un zona multe seca,Wüste,desert,NA,desierto,désert,NA,NA,NA,NA,NA,NA,NA,NA,NA,ørken,NA,he: מדבר,NA,NA
destina,nom,NA,Bestimmung,destination; destiny,NA,destino,destination,NA,NA,NA,NA,NA,NA,NA,NA,NA,betemmelsessted,NA,he: יעד; ייעוד,NA,NA
direto,nom governa filosofia,la autoria moral o legal per posese o oteni alga cosa o per ata en un modo spesifada,Recht,right,NA,derecho,droit (de l'homme,NA,NA,NA,NA,NA,NA,NA,NA,NA,ret,NA,he: זכות,NA,NA
dirije,nom,NA,Richten,direction,NA,dirección,direction,NA,NA,NA,NA,NA,NA,NA,NA,NA,retning,NA,he: כיוון,NA,NA
dito,nom anatomia,cada de la cuatro partes (o sinco,Finger,finger; digit,NA,dedo,doigt,NA,NA,NA,NA,NA,NA,NA,NA,NA,finger,NA,he: אצבע,NA,NA
eda,nom tera istoria siensa-umana,la cuantia de tempo tra cual un person o organisme ia vive o un cosa ia esiste; un periodo spesifada de istoria; (en jeolojia) un divide major de tempo,Alter,age (measure of years); age,NA,edad,âge,NA,NA,NA,NA,NA,NA,NA,NA,NA,alder,NA,he: גיל; עידן,NA,NA
eleje,nom,NA,Auswahl,choice,NA,selección,choix,NA,NA,NA,NA,NA,NA,NA,NA,NA,valg,NA,he: בחירה,NA,NA
enemi,nom governa,un person o persones ci oposa o ataca un person o cosa,Feind,enemy,NA,enemigo,NA,NA,NA,NA,NA,NA,NA,NA,NA,NA,fjende,NA,NA,NA,NA
estate,nom tera,la saison la plu calda de la anio,Sommer,summer,NA,verano,NA,NA,NA,NA,NA,NA,NA,NA,NA,NA,sommer,NA,NA,NA,NA
fabriceria,nom,NA,Fabrik,factory,NA,fábrica,NA,NA,NA,NA,NA,NA,NA,NA,NA,NA,fabrik,NA,NA,NA,NA
falda,nom veste,un veste esterna basa,Rock,skirt,NA,falda,NA,NA,NA,NA,NA,NA,NA,NA,NA,NA,skørt,NA,NA,NA,NA
fava,nom planta cosini,un seme comable,Bohne,bean (plant,NA,haba,NA,NA,NA,NA,NA,Phaseolus {e otras :: and others},NA,NA,NA,NA,bønne,NA,NA,NA,NA
feri,nom,NA,Wunde,wound,NA,herida,NA,NA,NA,NA,NA,NA,NA,NA,NA,NA,sår,NA,NA,NA,NA
fero,nom cimica,la elemento cimical con numero atomal 26; un metal dur,Eisen,iron,NA,hierro,NA,NA,NA,NA,NA,NA,NA,Fe,NA,NA,jern,NA,NA,NA,NA
filo,nom util,un estende longa e multe magra de lana,Draht,thread,NA,alambre,NA,NA,NA,NA,NA,NA,NA,NA,NA,NA,ståltråd,NA,NA,NA,NA
folia,nom biolojia,un parte plata de un planta,Blatt,leaf,NA,hoja; hoja,NA,NA,NA,NA,NA,NA,NA,NA,NA,NA,blad; ark (papir),NA,NA,NA,NA
forador,nom,NA,Bohrer,drill (tool),NA,taladro,NA,NA,NA,NA,NA,NA,NA,NA,NA,NA,NA,NA,NA,NA,NA
force,nom cosini,un util con du o plu dentes agu,Gabel,fork,NA,tenedor,NA,NA,NA,NA,NA,NA,NA,NA,NA,NA,gaffel,NA,NA,NA,NA
fortia,nom,NA,Kraft,strength,NA,fuerza,NA,NA,NA,NA,NA,NA,NA,NA,NA,NA,styrke,NA,NA,NA,NA
fungo,nom biolojia,cada de un rena de organismes primitiva cual nuri se con materia organica e reprodui par sporas,Pilz,fungus,NA,seta,NA,NA,NA,NA,NA,Fungi,NA,NA,NA,NA,svamp,NA,NA,NA,NA
futur,ajetivo filosofia,a un tempo plu tarda ca la momento de parla o scrive,Zukunft,future,NA,futuro,NA,NA,NA,NA,NA,NA,NA,NA,NA,NA,fremtid,NA,NA,NA,NA
garga,nom anatomia,la pasaje a dorso de la boca,Kehle,throat,NA,garganta,NA,NA,NA,NA,NA,NA,NA,NA,NA,NA,strube,NA,NA,NA,NA
gera,nom,NA,Krieg,war,NA,guerra,NA,NA,NA,NA,NA,NA,NA,NA,NA,NA,krig,NA,NA,NA,NA
grandia,nom,NA,Grösse,size,NA,tamaño,NA,NA,NA,NA,NA,NA,NA,NA,NA,NA,størrelse,NA,NA,NA,NA
ier,averbo,a la dia ante oji,Gestern,yesterday,hieraŭ,ayer,NA,NA,NA,NA,NA,NA,NA,NA,NA,NA,i går,NA,NA,NA,NA
imaje,nom arte informatica,un representa vidal,Bild,image,figuro,cuadro,NA,NA,NA,NA,NA,NA,NA,NA,NA,NA,billede,NA,NA,NA,NA
indente,nom,NA,Kerbe,dent,entranĉo,NA,NA,NA,NA,NA,NA,NA,NA,NA,NA,NA,hak,NA,NA,NA,NA
jacon,nom,un veste con mangas portada estra casa,Mantel,overcoat,NA,abrigo,NA,NA,NA,NA,NA,NA,NA,NA,NA,NA,frakke,NA,NA,NA,NA
jerme,verbo nontransitiva biolojia,(un planta) comensa crese,Spross,sprout,NA,brote,NA,NA,NA,NA,NA,NA,NA,NA,NA,NA,NA,NA,NA,NA,NA
jua,nom,NA,Spiel,game,NA,juego,NA,NA,NA,NA,NA,NA,NA,NA,NA,NA,spil (i sport o. lign.),NA,NA,NA,NA
labora,nom,NA,Arbeit,work,NA,NA,NA,NA,NA,NA,NA,NA,NA,NA,NA,NA,NA,NA,NA,NA,NA
lado,nom,un loca a sinistra o destra de alga cosa; la parte sinistra o destra de alga cosa; cada de la du duis de un cosa,Seite,side,NA,lado,NA,NA,NA,NA,NA,NA,NA,NA,NA,NA,side,NA,NA,NA,NA
lama,nom util,la borda agu de un cotel,Klinge,blade,NA,lámina,NA,NA,NA,NA,NA,NA,NA,NA,NA,NA,blad,NA,NA,NA,NA
