word,gramatica,defini,de,en,eo,es,fr,capital,nota,vide,orijina,tasonomia,pronuncia,simbol,usa,an,da,gl,he,mt,ru
atom,nom fisica,la unia fundal de un elemento cimical,Atom,atom,NA,átomo,atome,NA,NA,NA,de elinica atomos (nondividable),NA,NA,NA,NA,NA,atom,NA,he: אטום,NA,NA
auto,nom veculo,un veculo de strada,Auto,car,NA,coche,voiture,NA,NA,automobil,NA,NA,NA,NA,NA,NA,bil,NA,he: מכונית,NA,NA
bus,nom veculo,un veculo grande per transporta pasajores par stradas e vias,Bus,bus,NA,autobús,bus,NA,NA,NA,NA,NA,NA,NA,NA,NA,bus,autobús,he: אוטובוס,NA,NA
gas,nom fisica,un materia fluente como aira,Gas,gas,NA,gas,NA,NA,NA,NA,NA,NA,NA,NA,NA,NA,gas,NA,NA,NA,NA
iris,nom anatomia planta,un membrana plata e colorida ante la cornea de la oio; un planta con folias spadin e flores estravagante,Iris,iris (eye,NA,iris (ojo,NA,NA,NA,NA,NA,Iris,NA,NA,NA,NA,iris,NA,NA,NA,NA
mais,nom planta cosini,un planta sereal con granes grande; esta granes,Mais,corn,NA,maíz,NA,NA,NA,NA,NA,Zea mays,NA,NA,NA,NA,majs,NA,NA,NA,NA
mineral,nom,NA,Mineral,mineral,NA,mineral,NA,NA,NA,NA,NA,NA,NA,NA,NA,NA,mineral,NA,NA,NA,NA
motor,nom util,un macina cual furni la potia per move un veculo o per opera un otra macina con partes movente,Motor,motor,NA,motor,NA,NA,NA,NA,NA,NA,NA,NA,NA,NA,motor,NA,NA,NA,NA
natur,nom biolojia,la fenomenos de la mundo fisical,Natur,nature,NA,naturaleza,NA,NA,NA,NA,NA,NA,NA,NA,NA,NA,natur,NA,NA,NA,NA
neon,nom cimica,la elemento cimical con numero atomal 10,Neon,neon,NA,NA,NA,NA,NA,NA,NA,NA,NA,Ne,NA,NA,neon,NA,NA,NA,NA
oval,ajetivo matematica,con forma ronda e cuasi longida,Oval,oval,NA,óvalo,NA,NA,NA,NA,NA,NA,NA,NA,NA,NA,oval,NA,NA,NA,NA
pedal,nom util,un lever operada par un pede,Pedal,pedal,NA,pedal,NA,NA,NA,NA,NA,NA,NA,NA,NA,NA,pedal,NA,NA,NA,NA
penis,nom anatomia,la organo mas de reprodui en vertebratos alta,Penis,penis,NA,pene,NA,NA,NA,NA,NA,NA,NA,NA,NA,NA,penis,NA,NA,NA,NA
person,nom filosofia siensa-umana,un umana videda como un individua; un organisme con consensia simil a un umana,Person,person,NA,persona,NA,NA,NA,NA,NA,NA,NA,NA,NA,NA,person,NA,NA,NA,NA
problem,nom,un situa,Problem,problem; difficulty,problemo,problema,problème,NA,NA,NA,NA,NA,NA,NA,NA,NA,problem,NA,NA,NA,NA
sofa,nom arciteta,un seja longa e tapetida con un dorso,Sofa,sofa,sofo,sofá,sofa,NA,NA,NA,NA,NA,NA,NA,NA,NA,NA,NA,NA,NA,ru: софа
telefon,nom util,un aparato cual cambia vibras de sona a siniales eletrical e la reversa,Telefon,telephone,NA,teléfono,téléphone,NA,NA,NA,NA,NA,NA,NA,NA,NA,telefon,NA,NA,NA,ru: телефон
temperatur,nom,la grado de caldia presente en un materia o ojeto,Temperatur,temperature,NA,temperatura,température,NA,NA,NA,NA,NA,NA,NA,NA,NA,temperatur,NA,NA,NA,NA
tomate,nom planta cosini,un planta de America Sude en familia de solano; la fruta pulposa e roja o jala de esta,Tomate,tomato,NA,tomate,tomate,NA,NA,NA,NA,Solanum lycopersicum,NA,NA,NA,NA,tomat,NA,NA,NA,NA
tornado,nom tera,un vortis de ventas destruinte cual aspeta como un nube embutin e avansa su un tempesta grande,Tornado,tornado,NA,tornado,tornade,NA,NA,NA,NA,NA,NA,NA,NA,NA,tornado,NA,NA,NA,NA
veranda,nom arciteta,un plataforma con teto a la lado de un casa,Veranda,veranda,NA,porche,véranda,NA,NA,NA,NA,NA,NA,NA,NA,NA,NA,NA,NA,NA,ru: веранда
virus,nom biolojia medica informatica,un organisme infetante,Virus,virus,NA,virus,virus,NA,NA,NA,NA,NA,NA,NA,NA,NA,virus,NA,NA,NA,NA
Afganistan,nom jeografial,un pais en Asia sude e Asia sentral,Afghanistan,Afghanistan,Afganio,Afganistán,Afghanistan,Kabul,NA,NA,NA,NA,NA,NA,NA,NA,Afghanistan,NA,אפגניסטן,NA,ru: Афганистан
axa,nom util,un util tipal usada per talia lenio,Axt,axe|ax,NA,hacha,hache,NA,NA,NA,NA,NA,NA,NA,NA,NA,økse,NA,he: גרזן,NA,NA
bal,nom sporte,un sfera o oval,Ball,ball,NA,balón,ballon,NA,NA,NA,NA,NA,NA,NA,NA,NA,bold,bóla,he: כדור,NA,NA
balon,nom,NA,Ballon,balloon; (speech) bubble,NA,globo (aerostático),ballon,NA,NA,NA,NA,NA,NA,NA,NA,NA,ballon,NA,he: בלון,NA,NA
bambu,nom planta,un erba leniosa e jigante cual abita xef la tropicos; la talo de esta,Bambus,bamboo (plant,NA,bambú (planta,bambou,NA,NA,NA,NA,Bambusa,NA,NA,NA,NA,bambus,NA,he: במבוק,NA,NA
banana,nom planta cosini,un arbor tropical con folias multe grande e frutas cual crese en grupos; la fruta comable de esta,Banane,banana (plant,NA,plátano,banane; bananier,NA,NA,NA,NA,Musa,NA,NA,NA,NA,banan,NA,he: בננה,NA,NA
basebal,nom sporte,un sporte con du ecipos de nove juores en cual on colpa un bal peti con un baston e core sirca un diamante de bases,Baseball,baseball,NA,béisbol,baseball,NA,NA,NA,NA,NA,NA,NA,NA,NA,baseball,NA,he: בייסבול,NA,NA
bir,nom cosini,un bevida alcolosa fermentada de malta e saborida con lupulos,Bier,beer,NA,cerveza,bière,NA,NA,NA,NA,NA,NA,NA,NA,NA,øl,NA,he: בירה,NA,NA
bloco,nom arciteta,un peso de materia grande,Block,block,NA,bloque,bloc,NA,NA,NA,NA,NA,NA,NA,NA,NA,blok,NA,he: גוש,NA,NA
bomba,nom cimica util,un contenador plen de materia esplodente e ensendente,Bombe,bomb,NA,bomba,bombe,NA,NA,NA,NA,NA,NA,NA,NA,NA,bombe,NA,he: פצצה,NA,NA
Burcina Faso,nom jeografial,un pais sin costa en Africa ueste,Burkina Faso,Burkina Faso,Burkino,NA,Burkina Faso,Ouagadougou,NA,NA,NA,NA,NA,NA,NA,NA,Burkina Faso,NA,בורקינה פאסו,NA,ru: Буркина-Фасо
canal,nom,un rio artifis,Kanal,canal,NA,canal,canal,NA,NA,NA,NA,NA,NA,NA,NA,NA,kanal,canle,he: תעלה,NA,NA
club,nom,un asosia dedicada a un interesa o ativia spesifada,Klub,club,NA,NA,club,NA,NA,NA,NA,NA,NA,NA,NA,NA,NA,NA,he: מועדון,NA,NA
cultur,nom siensa-umana,la abituas,Kultur,culture,NA,cultura,culture,NA,NA,NA,NA,NA,NA,NA,NA,NA,kultur,NA,he: תרבות,NA,NA
familia,nom siensa-umana,un grupo de persones composada de persones relatada par sangue o sposi,Familie,family,NA,familia,NA,NA,NA,NA,NA,NA,NA,NA,NA,NA,familie,NA,NA,NA,NA
fe,nom mitolojia,un organisme mital,Fee,fairy,NA,hada,NA,NA,NA,NA,NA,NA,NA,NA,NA,fada,fe,NA,NA,NA,NA
forma,nom,la aspeta de la contorno de un cosa en du o tre dimensiones; la posa de la partes de un cosa; la fortia e sania de la corpo de un person; la regulas de condui en sosia cortes,Form,form,NA,forma,NA,NA,NA,NA,NA,NA,NA,NA,NA,NA,form,NA,NA,NA,NA
idea,nom filosofia siensa-umana,un pensa,Idee,idea,ideo,idea,NA,NA,NA,NA,NA,NA,NA,NA,NA,NA,ide,NA,NA,NA,NA
jen,nom biolojia,un unia de erita,Gen,gene,NA,gen,NA,NA,NA,NA,NA,NA,NA,NA,NA,NA,gen,NA,NA,NA,NA
lampa,nom util,un aparato per lumina,Lampe,lamp,NA,lámpara,NA,NA,NA,NA,NA,NA,NA,NA,NA,NA,lampe,NA,NA,NA,NA
linia,nom,un marca o banda longa e streta; (en matematica) un estende continuante de longia sin largia; un cuantia de persones o cosas en un tal forma,Linie,line,NA,línea,NA,NA,NA,NA,NA,NA,NA,NA,NA,NA,linie,NA,NA,NA,NA
magnete,nom fisica,un peso de fero cual atrae otra ojetos conteninte fero,Magnet,magnet,NA,imán,NA,NA,NA,NA,NA,NA,NA,NA,NA,NA,magnet,NA,NA,NA,NA
medisin,nom medica,un droga usada per trata o preveni maladia,Medizin,medicine (drugs),NA,medicina,NA,NA,NA,NA,NA,NA,NA,NA,NA,NA,medicin,NA,NA,NA,NA
metal,nom,NA,Metall,metal,NA,metal,NA,NA,NA,NA,NA,NA,NA,NA,NA,NA,metal,NA,NA,NA,NA
milion,determinante matematica,{1(~)000(~)000},Million,(a) million,NA,millón,NA,NA,On dise `du milion`,NA,NA,NA,NA,NA,NA,NA,million,NA,NA,NA,NA
minuto,nom,un periodo de tempo egal a 60 secondos o un sesdesi de un ora; un sesdesi de un grado angulo,Minute,minute,NA,minuto,NA,NA,NA,NA,NA,NA,NA,NA,NA,NA,minut,NA,NA,NA,NA
moda,nom veste cosini linguistica informatica,un tende popular,Mode,fashion,NA,moda,NA,NA,NA,NA,NA,NA,NA,NA,NA,NA,mode,NA,NA,NA,NA
mus,nom mamal informatica,un rodente peti con beco puntida,Maus,mouse,NA,ratón,NA,NA,NA,NA,NA,Mus,NA,NA,NA,NA,mus,NA,NA,NA,NA
narval,nom mamal,un balena peti de la Mar Artica,Narwal,narwhal (whale),NA,narval,narval,NA,NA,NA,NA,Monodon monoceros,NA,NA,NA,NA,NA,NA,NA,NA,NA
nas,nom anatomia,la parte supra la boca de un person o animal,Nase,nose,NA,nariz,NA,NA,NA,NA,NA,NA,NA,NA,NA,NA,næse,NA,NA,NA,NA
nasion,nom governa,un colie grande de persones,Nation,nation,NA,nación,NA,NA,NA,NA,NA,NA,NA,NA,NA,NA,nation,NA,NA,NA,NA
nervo,nom anatomia,un fibre blancin,Nerv,nerve,NA,nervio,NA,NA,NA,NA,NA,NA,NA,NA,NA,NA,nerve,NA,NA,NA,NA
norde,nom,NA,Nord,north,NA,norte,NA,NA,NA,NA,NA,NA,NA,NA,NA,NA,nord,NA,NA,NA,NA
oliva,nom,un fruta peti e oval con seme dur e pulpa amarga,Olive,olive (fruit),NA,oliva,NA,NA,NA,NA,NA,NA,NA,NA,NA,NA,NA,NA,NA,NA,NA
otel,nom arciteta,un instituida cual furni un abiteria tempora,Hotel,hotel,NA,hotel,NA,NA,NA,NA,NA,NA,NA,NA,NA,NA,hotel,NA,NA,NA,NA
paper,nom util,la materia fabricada en folias magra de la pulpa de lenio o otra materias fibrosa,Papier,paper,NA,papel,NA,NA,NA,NA,NA,NA,NA,NA,NA,NA,papir,NA,NA,NA,NA
parlamento,nom governa,la institui la plu alta per crea leges en un nasion o stato,Parlament,parliament,NA,parlamento,NA,NA,NA,NA,NA,NA,NA,NA,NA,NA,parlament,NA,NA,NA,NA
piza,nom cosini,un comeda italian,Pizza,pizza,NA,pizza,NA,NA,NA,NA,NA,NA,NA,NA,NA,NA,pizza,NA,NA,NA,NA
planeta,nom astronomia,un masa grande en spasio cual move en un orbita elise sirca un stela,Planet,planet,planedo,planeta,planète,NA,NA,NA,NA,NA,NA,NA,NA,NA,planet,NA,NA,NA,NA
posta,nom,NA,Post,post,poŝto,correo,courrier,NA,NA,NA,NA,NA,NA,NA,NA,NA,NA,NA,NA,NA,ru: почта (письма и т.п.)
profesor,nom governa,un mestre o ensenior con un diploma avansada,Professor,professor,profesoro,profesor,professeur,NA,NA,NA,NA,NA,NA,NA,NA,NA,NA,NA,NA,NA,ru: профессор
program,nom informatica,un desinia o projeta per un prosede,Programm,program|programme,programo,programa,programme,NA,NA,NA,NA,NA,NA,NA,NA,NA,program,NA,NA,NA,NA
protesta,nom,NA,Protest,protest,protesto,protesta,protestation; manifestation,NA,NA,NA,NA,NA,NA,NA,NA,NA,protest,NA,NA,NA,NA
resta,nom,NA,Rest,remainder,resto,resto,repos,NA,NA,NA,NA,NA,NA,NA,NA,NA,rest,NA,NA,NA,NA
ris,nom planta cosini,un erba de pantanes cual es comun cultivada,Reis,rice,rizo,arroz,riz,NA,NA,NA,NA,Oryza sativa,NA,NA,NA,NA,ris,NA,NA,NA,NA
rituo,nom siensa-umana relijio,un serie de atas tradisional per selebra un aveni publica o relijiosa,Ritus,ritual,rito,ritual,rituel,NA,NA,NA,NA,NA,NA,NA,NA,NA,ritual,NA,NA,NA,NA
rosa,nom planta,un arboreta cual produi tipal flores bonodorosa roja,Rose,rose,rozo,rosal,rose,NA,NA,NA,NA,Rosa,NA,NA,NA,NA,rose,NA,NA,NA,NA
saco,nom util,un contenador de material flexable,Sack,bag,sako,saco,sac,NA,NA,NA,NA,NA,NA,NA,NA,NA,sæk,NA,NA,NA,NA
sal,nom cimica cosini,clorido de sodio,Salz,salt,salo,sal,sel,NA,NA,NA,NA,NA,NA,NA,NA,NA,salt,NA,NA,NA,ru: соль
sandal,nom veste,un sapato lejera de cual sua planta es liada a sua pede par bandas,Sandale,sandal,sandalo,sandalia,sandale,NA,NA,NA,NA,NA,NA,NA,NA,NA,NA,NA,NA,NA,ru: сандалия
sci,nom sporte,cada de du pesos longa e magra de un materia flexable,Schi,ski; skiing,skio,esquí,(un) ski; (le) ski,NA,NA,NA,NA,NA,NA,NA,NA,NA,ski,NA,NA,NA,NA
sesamo,nom planta cosini,un planta alta de zonas tropical e sutropical de Africa e Asia,Sesam,sesame (plant,sezamo,sésamo,sésame,NA,NA,NA,NA,Sesamum,NA,NA,NA,NA,sesamfrø,NA,NA,NA,NA
sistem,nom filosofia,un colie de partes cual formi un intera complicada como un rede o macina; (en biolojia) un colie de organos en la corpo con strutur o funsiona comun; (en informatica) un grupo relatada de aparatos o programes o ambos,System,system,sistemo,sistema,système,NA,NA,NA,NA,NA,NA,NA,NA,NA,system,NA,NA,NA,NA
soldato,nom governa,un person ci servi en un armada,Soldat,soldier,soldato,soldado,soldat,NA,NA,NA,NA,NA,NA,NA,NA,NA,soldat,NA,NA,NA,ru: солдат
spinax,nom planta cosini,un planta asian multe cultivada,Spinat,spinach (plant,spinaco,espinaca,épinards,NA,NA,NA,NA,Spinacia oleracea,NA,NA,NA,NA,spinat,NA,NA,NA,NA
spiral,nom,NA,Spirale,spiral,spiralo,espiral,spirale,NA,NA,NA,NA,NA,NA,NA,NA,NA,spiral,NA,NA,NA,NA
stofa,nom veste,cualce materia produida par texe o tricota fibres,Stoff,fabric,NA,paño,tissu,NA,NA,tela,NA,NA,NA,NA,NA,NA,klæde,NA,NA,NA,ru: ткань
strutur,nom arciteta,la ordina de e relatas entre partes o elementos de un cosa complicada; un construida rijida cual suporta o enclui alga cosa como un fenetra,Struktur,structure,strukturo,estructura,structure,NA,NA,NA,NA,NA,NA,NA,NA,NA,struktur,NA,NA,NA,NA
talento,nom arte sporte,un capasia natural,Talent,talent,NA,talento,talent,NA,NA,NA,NA,NA,NA,NA,NA,NA,dygtighed,NA,NA,NA,NA
te,nom planta cosini,un arboreta trovada en Asia sude e este; un bevida calda preparada par infusa la folias secida e craseda de esta en acua bolinte; esta folias; un bevida fria preparada par ajunta jelo a te calda,Tee,tea (plant,NA,té,thé,NA,NA,NA,NA,Camellia sinensis,NA,NA,NA,NA,te,NA,NA,NA,ru: чай
tema,nom,la idea xef de un parla,Thema,theme,NA,sujeto,sujet,NA,NA,NA,NA,NA,NA,NA,NA,NA,emne,NA,NA,NA,NA
tenis,nom sporte,un sporte en cual du o cuatro juores usa racetas per colpa un bal supra un rede cual traversa un campo contornida,Tennis,tennis,NA,tenis,tennis,NA,NA,NA,NA,NA,NA,NA,NA,NA,tennis,NA,NA,NA,NA
tigre,nom mamal,un gato multe grande,Tiger,tiger,NA,tigre,tigre,NA,NA,NA,NA,Panthera tigris,NA,NA,NA,NA,tiger,NA,NA,NA,NA
tun,nom pex cosini,un pex grande e xasante en familia de macero,Thun,tuna,NA,atún,thon,NA,NA,NA,NA,Thunnus,NA,NA,NA,NA,NA,NA,NA,NA,ru: тунец
uniforma,nom,un colie de vestes identica portada par membros de la mesma profesa,Uniform,uniform (dress),NA,uniforme,uniforme,NA,NA,NA,NA,NA,NA,NA,NA,NA,uniform,NA,NA,NA,NA
vagon,nom veculo,un veculo pesosa con rotas ma sin motor,Wagon,wagon,vagono,carreta,wagon,NA,NA,NA,NA,NA,NA,NA,NA,NA,køretøj vogn,NA,NA,NA,ru: вагон
vena,nom anatomia,cada de la dutos de sangue cual transporta xef la sangue sin multe osijen a la cor; un strato magra de roca cual difere de sua ambiente,Vene,vein (anatomy); lode (geology),vejno,vena,veine,NA,NA,NA,NA,NA,NA,NA,NA,NA,vene,NA,NA,NA,NA
anjel,nom relijio mitolojia,(en alga credes) un spirito cual es un aidor o mesajor de Dio,Engel,angel,NA,ángel,ange,NA,NA,NA,NA,NA,NA,NA,NA,ánxel,engel,NA,he: מלאך,NA,NA
armonia,nom musica,la efeto plasente produida par un combina simultan de notas musical,Harmonie,harmony,NA,armonía,harmonie,NA,NA,NA,NA,NA,NA,NA,NA,NA,harmoni,harmonía,he: הרמוניה,NA,NA
article,nom informatica,cada de la testos diversa en un jornal,Artikel,article (document); record,NA,artículo,article,NA,NA,NA,NA,NA,NA,NA,NA,NA,artikel,artigo,he: מאמר,NA,NA
ata,nom,un cosa fada; un documento legal; un divide de un teatral o simil,Tat,action,NA,acto,acte,NA,NA,NA,NA,NA,NA,NA,NA,NA,handling,NA,he: פעולה,NA,NA
banco,nom mone,un instituida finansial cual investi mone deponeda par clientes,Bank,bank (money),NA,banco,banque,NA,NA,NA,NA,NA,NA,NA,NA,NA,bank,NA,he: בנק,NA,NA
barba,nom anatomia,un crese de capeles sur la mento e jenas de la fas de un om; un mexa simil sur la mento de alga animales,Bart,beard,NA,barba,barbe,NA,NA,NA,NA,NA,NA,NA,NA,NA,skæg,NA,he: זקן (שיער פנים),NA,NA
bebe,nom,un enfante multe joven,Baby,baby,NA,bebé,bébé,NA,NA,NA,NA,NA,NA,NA,NA,NA,baby,NA,he: תינוק; גור,NA,NA
biliardo,nom sporte,un jua con spesies diversa ma tipal per du persones,Billiard,billiards,NA,billar,billard,NA,NA,NA,NA,NA,NA,NA,NA,NA,billiard,NA,he: ביליארד (משחק),NA,NA
canon,nom relijio musica,un colie de libros santa; un colie de testos asetada como autentica; un musica con un melodia xef cual otra strumentos imita a intervales,Kanone,canon (literature,NA,cañón,canon (littérature,NA,NA,NA,NA,NA,NA,NA,NA,NA,kanon,NA,he: (ספרות,NA,NA
capitol,nom arte,un divide major de un libro,Kapitel,chapter,NA,capítulo,chapitre,NA,NA,NA,NA,NA,NA,NA,NA,NA,kapitel,NA,he: פרק,NA,NA
carater,nom siensa-umana,la cualias mental cual distingui un individua de otras; un person en un novela,Charakter,character (including in fiction),NA,carácter,caractère,NA,NA,NA,NA,NA,NA,NA,NA,NA,karakter,NA,he: אופי,NA,NA
carta,nom,un paper rijida e retangulo,Karte,card,NA,tarjeta,carte,NA,NA,NA,NA,NA,NA,NA,NA,NA,kort,NA,he: כרטיס; קלף,NA,NA
categoria,nom,un clase o divide de persones o cosas par sua cualias comun; (en filosofia) cada de un grupo de clases entre cual on pote cisa distribui tota cosas,Kategorie,category,NA,categoría,catégorie,NA,NA,NA,NA,NA,NA,NA,NA,NA,kategori,NA,he: קטגוריה,NA,NA
col,nom planta cosini,un planta cultivada,Kohl,cabbage (plant,NA,col,chou,NA,NA,NA,NA,Brassica oleracea,NA,NA,NA,NA,kål,NA,he: כרוב,NA,NA
conta,nom,un ata de conta; un cuantia contada; un arcivo o rejistra de resetas o spendes per un periodo spesifada; un acorda par cual un instituida teni mone per un cliente,Konto,count (action,NA,cuenta,compte,NA,NA,NA,NA,NA,NA,NA,NA,NA,konto,NA,he: ספירה,NA,NA
corno,nom biolojia,un crese dur trovada en duples,Horn,horn (animal,NA,cuerno,corne; klaxon; cor,NA,NA,NA,NA,NA,NA,NA,NA,NA,horn,NA,he: קרן (של בעל-חיים); שופר,NA,NA
credito,nom mone,la capasia de un person per oteni benes o servis ante paia,Kredit,credit (money),NA,crédito,crédit,NA,NA,NA,NA,NA,NA,NA,NA,NA,kredit,NA,he: אשראי,NA,NA
cristal,nom,NA,Kristall,crystal,NA,cristal,cristal,NA,NA,NA,NA,NA,NA,NA,NA,NA,krystal,NA,he: גביש,NA,NA
cuarzo,nom tera,un mineral dur e blanca o sin color,Quarz,quartz,NA,cuarzo,quartz,NA,NA,NA,NA,NA,NA,NA,NA,NA,kvarts,NA,he: קוורץ,NA,NA
curva,nom,NA,Kurve,curve,NA,curva,courbe,NA,NA,NA,NA,NA,NA,NA,NA,NA,kurve,NA,he: עקומה,NA,NA
data,nom,un dia de mense o anio,Datum,date (calendar),NA,fecha,date (calendrier),NA,NA,NA,NA,NA,NA,NA,NA,NA,dato,NA,תאריך,NA,ru: дата
detalia,nom,un cualia,Detail,detail,NA,detalle,détail,NA,NA,NA,NA,NA,NA,NA,NA,NA,detalje,NA,he: פרט; פירוט,NA,NA
elmo,nom veste,un xapo dur,Helm,helmet,NA,casco,casque,NA,NA,NA,NA,NA,NA,NA,NA,NA,hjelm,NA,he: קסדה,NA,NA
enerjia,nom fisica,la fortia nesesada per ativia fisical o mental; la potia derivada de recursos fisical o cimical,Energie,energy,NA,energía,NA,NA,NA,NA,NA,NA,NA,NA,NA,NA,energi,NA,NA,NA,NA
este,nom,NA,Ost,east,NA,este,NA,NA,NA,NA,NA,NA,NA,NA,NA,NA,øst,NA,NA,NA,NA
eticeta,nom veste informatica,un peso peti de paper,Etikett,label,NA,etiqueta,NA,NA,NA,NA,NA,NA,NA,NA,NA,NA,nærke,NA,NA,NA,NA
febre,nom medica,un temperatur nonormal alta de la corpo,Fieber,fever,NA,fiebre,NA,NA,NA,NA,NA,NA,NA,NA,NA,NA,feber,NA,NA,NA,NA
figa,nom planta cosini,un fruta mol con forma de pera,Feige,fig (fruit),NA,higo,NA,NA,NA,NA,NA,NA,NA,NA,NA,NA,figen,NA,NA,NA,NA
foto,nom arte,un imaje creada par usa un camera,Photo,photo,NA,fotografía,NA,NA,NA,NA,NA,NA,NA,NA,NA,NA,fotografi,NA,NA,NA,NA
gitar,nom musica,un strumento musical de cordetas,Gitarre,guitar,NA,guitarra,NA,NA,NA,NA,NA,NA,NA,NA,NA,NA,guitar,NA,NA,NA,NA
grupo,nom,un cuantia de persones o cosas prosima a lunlotra o clasida con lunlotra,Gruppe,group,NA,grupo,NA,NA,NA,NA,NA,NA,NA,NA,NA,NA,gruppe; parti (samling af produkter),NA,NA,NA,NA
inseto,nom artropodo,un artropodo peti con ses gamas e tipal un o du duples de alas,Insekt,insect,NA,insecto,NA,NA,NA,NA,NA,Insecta,NA,NA,NA,NA,insekt,NA,NA,NA,NA
interesa,nom,un senti de curiosia; mone periodal paiada a un taso spesifada,Interesse,interest (including money),NA,interés,NA,NA,NA,NA,NA,NA,NA,NA,el ave un interesa grande a arte medieval,NA,interesse,NA,NA,NA,NA
jaca,nom veste,un veste lejera con mangas,Jacke,coat,NA,chaqueta americana,NA,NA,NA,NA,NA,NA,NA,NA,NA,NA,jakke,NA,NA,NA,NA
jinsen,nom planta,un planta nativa de Asia este e America Norde; un tuber de esta planta,Ginseng,ginseng (plant,NA,ginseng,NA,NA,NA,NA,NA,Panax,NA,NA,NA,NA,ginseng,NA,NA,NA,NA
laica,nom,NA,Laie,layperson,NA,lego,laïc,NA,NA,NA,NA,NA,NA,NA,NA,NA,NA,NA,NA,NA,NA
lente,nom util,un peso de vitro o otra materia transparente con lados curva per consentra o sperde lus,Linse,lens,NA,lente (de cristal o similar),NA,NA,NA,NA,NA,NA,NA,NA,NA,NA,linse,NA,NA,NA,NA
leto,nom arciteta,un mobila o otra surfas usada per dormi o reposa,Bett,bed,NA,cama,NA,NA,NA,NA,NA,NA,NA,NA,NA,NA,bed,NA,NA,NA,NA
lino,nom planta util veste,un planta con flores blu,Lein,flax,NA,lino,NA,NA,NA,NA,NA,Linum usitatissimum,NA,NA,NA,NA,hør,NA,NA,NA,NA
mano,nom anatomia,la parte final de un braso,Hand,hand; handful,NA,mano,NA,NA,NA,NA,NA,NA,NA,NA,NA,NA,hånd,NA,NA,NA,NA
mar,nom tera,un corpo grande de acua salin cual covre la plu de la surfas de la Tera,Meer,sea,NA,mar,NA,NA,NA,NA,NA,NA,NA,NA,NA,NA,hav,NA,NA,NA,NA
metodo,nom filosofia relijio,un modo spesifada per fa alga cosa,Methode,method,NA,método,NA,NA,NA,NA,NA,NA,NA,NA,NA,NA,metode,NA,NA,NA,NA
museo,nom arciteta,un construida en cual on conserva e esibi ojetos de interesa istorial,Museum,museum,NA,museo,NA,NA,NA,NA,NA,NA,NA,NA,NA,NA,museum,NA,NA,NA,NA
musica,nom musica,sonas de vose o strumentos,Musik,music,NA,música,NA,NA,NA,NA,NA,NA,NA,NA,NA,NA,musik,NA,NA,NA,NA
nebla,nom tera,un nube densa de gotas peti de acua,Nebel,fog,NA,niebla,NA,NA,NA,NA,NA,NA,NA,NA,NA,NA,tåge,NA,NA,NA,NA
nom,nom linguistica,un parola o grupo de parolas cual identifia unica un person,Name,name,nomo; sustantivo,nombre,NA,NA,NA,NA,NA,NA,NA,NA,NA,NA,navn,NA,NA,NA,NA
nota,nom,un rejistra corta scriveda per aida recorda; un letera o mesaje corta scriveda; (en musica) un tono musical de altia spesifada; un sinia scriveda cual representa un tal tono,Notiz,note,NA,nota,NA,NA,NA,NA,NA,NA,NA,NA,NA,NA,note,NA,NA,NA,NA
numero,nom matematica,la valua aritmetical de un parola,Nummer,number (in sequence); numeral (grammar); issue,NA,número,NA,NA,No usa `numero` per dise `cuantia`. 40 es un numero,cuantia,NA,NA,NA,NA,NA,NA,nummer,NA,NA,NA,NA
orania,nom,un fruta grande,Orange,orange (fruit),NA,NA,NA,NA,NA,NA,NA,NA,NA,NA,NA,NA,appelsin,NA,NA,NA,NA
paceta,nom,NA,Paket,package,NA,paquete,NA,NA,NA,NA,NA,NA,NA,NA,NA,NA,pakke,NA,NA,NA,NA
parce,nom arciteta,un jardin publica usada per recrea; un area grande mantenida en un state natural per usas publica o per conserva animales savaje; un area reservada per un intende spesifada,Park,park,NA,parque,NA,NA,NA,NA,NA,NA,NA,NA,NA,NA,park,NA,NA,NA,NA
plaza,nom arciteta,un area publica e abrida,Platz,plaza,NA,plaza,place,NA,NA,NA,NA,NA,NA,NA,NA,NA,kvadrat,NA,NA,NA,ru: площадь
politica,nom governa,la ativias asosiada con la governa de un nasion o rejion,Politik,politics; policy,politiko,política,la politique,NA,NA,NA,NA,NA,NA,NA,NA,NA,politik,NA,NA,NA,NA
pompa,nom util,un aparato cual usa suca o presa per leva o move licuidas,Pumpe,pump,pumpilo,bomba,pompe,NA,NA,NA,NA,NA,NA,NA,NA,NA,pumpe,NA,NA,NA,ru: насос
portamone,nom verbo-nom,un contenador peti e pliable per mone e cartas de credito,Portemonee,wallet,monujo,billetero,portefeuille,NA,NA,NA,NA,NA,NA,NA,NA,NA,NA,NA,NA,NA,ru: кошелек
premio,nom sporte,un cosa donada a un ganior de un concurso o per reconose un otra ateni eselente; un cosa,Prämie,prize,premio,premio,prix,NA,NA,NA,NA,NA,NA,NA,NA,NA,pris,NA,NA,NA,NA
presidente,nom,NA,Präsident,president,prezidanto,presidente,président,NA,NA,NA,NA,NA,NA,NA,NA,NA,president,NA,NA,NA,NA
provinse,nom governa,un parte major de alga nasiones o imperos,Provinz,province,provinco,provincia,province,NA,NA,NA,NA,NA,NA,NA,NA,NA,provins,NA,NA,NA,NA
pupa,nom util biolojia,un model peti de un umana,Puppe,doll,pupo,muñeca,poupée,NA,NA,NA,NA,NA,NA,NA,NA,NA,dukke,NA,NA,NA,NA
regula,nom,NA,Regel,rule,regulo,regla,règle,NA,NA,NA,NA,NA,NA,NA,NA,NA,regel,NA,NA,NA,NA
relijio,nom relijio,la crede e adora de un potia controlante supraumana,Religion,religion,religio,religión,religion,NA,NA,NA,NA,NA,NA,NA,NA,NA,religion,NA,NA,NA,NA
rol,nom arte siensa-umana,un parte en un presenta,Rolle,role,rolo,papel,rôle,NA,NA,NA,NA,NA,NA,NA,NA,NA,rolle,NA,NA,NA,NA
salada,nom cosini,un plato fria de miscas de vejetales ru o coceda,Salat,salad,salato,ensalada,salade,NA,NA,NA,NA,NA,NA,NA,NA,NA,salat,NA,NA,NA,ru: салат
sclavo,nom governa istoria,un person ci es la propria legal de un otra e debe obedi el; algun ci labora forte sin paia o reconose,Sklav,slave,sklavo,esclavo,esclave,NA,NA,NA,NA,NA,NA,NA,NA,NA,slave,NA,NA,NA,NA
seda,nom veste,un fibre magra,Seide,silk,silko,seda,soie,NA,NA,NA,NA,NA,NA,NA,NA,NA,silke,NA,NA,NA,ru: шёлк
seme,nom biolojia,la unia de reprodui de un planta florinte,Samen,seed; pip,semo,semilla,graine,NA,NA,NA,NA,NA,NA,NA,NA,NA,sæd,NA,NA,NA,NA
seta,nom relijio,un grupo de persones con credes relijial alga diferente de los de la grupo la plu grande en cual los es membros,Sekte,sect,sekto,secta (religiosa),secte,NA,NA,NA,NA,NA,NA,NA,NA,NA,sekt (religiøs),NA,NA,NA,NA
silaba,nom linguistica,un unia de pronunsia,Silbe,syllable,silabo,sílaba,syllabe,NA,NA,NA,NA,NA,NA,NA,NA,NA,stavelse,NA,NA,NA,NA
Sra,corti,Seniora,Frau,Mrs,S-ino,Sra.,Mme.,NA,NA,NA,NA,NA,NA,NA,NA,NA,Fr.,NA,NA,NA,NA
stato,nom governa,un nasion o teritorio regardada como un comunia political organizada su un governa; un comunia o rejion political organizada cual es un parte de un republica federal,Staat,state (political),ŝtato,estado,état,NA,NA,NA,NA,NA,NA,NA,NA,NA,stat,NA,NA,NA,NA
steca,nom cosini,un peso spesa de carne de bove,Steak,steak,steko,bistec,bifteck,NA,NA,NA,NA,NA,NA,NA,NA,NA,NA,NA,NA,NA,ru: бифштекс
stela,nom astronomia,un punto stable e luminosa en la sielo a note cual es un corpo grande,Stern,star (sun,stelo,estrella,étoile,NA,NA,NA,NA,NA,NA,*,NA,NA,stjerne,NA,NA,NA,NA
sude,nom,NA,Süd,south,sudo,sur,sud,NA,NA,NA,NA,NA,NA,NA,NA,NA,syd,NA,NA,NA,NA
tabaco,nom planta,un planta de la tropicos american en familia de solano; la folias de esta,Tabak,tobacco (plant,NA,tabaco,tabac,NA,NA,NA,NA,Nicotiana tabacum,NA,NA,NA,NA,tobak,NA,NA,NA,NA
taie,nom anatomia,la parte de la corpo umana su la costelas e supra la ancas; la parte de un veste cual ensirca o covre esta; (metafor) la parte en la media de un cosa como un violin,Taille,waist,NA,cintura,taille (partie du corps),NA,NA,NA,NA,NA,NA,NA,NA,NA,liv,NA,NA,NA,NA
tas,nom cosini,un contenador peti con forma de bol,Tasse,cup,NA,taza,tasse,NA,NA,NA,NA,NA,NA,NA,NA,NA,kop,NA,NA,NA,ru: чашка
tende,nom,NA,Tendenz,tendency,NA,tendencia,tendance,NA,NA,NA,NA,NA,NA,NA,NA,NA,tendens,NA,NA,NA,NA
